{
  "id": "fixture:fs:readFile:utf8-basic",
  "api_family": "fs",
  "api_name": "readFile",
  "band": "core",
  "description": "Read a UTF-8 text file and return its contents as a string.",
  "input": {
    "args": ["test.txt", {"encoding": "utf8"}],
    "files": {"test.txt": "hello world\n"}
  },
  "expected_output": {
    "return_value": "hello world\n",
    "error": null,
    "side_effects": null
  },
  "oracle_source": "node-20.11.0",
  "tags": ["core", "fs", "readFile", "utf8"]
}
