{
  "id": "fixture:path:extname:simple",
  "api_family": "path",
  "api_name": "extname",
  "band": "core",
  "description": "extname returns file extension",
  "input": {
    "args": ["file.txt"]
  },
  "expected_output": {
    "return_value": ".txt",
    "error": null,
    "side_effects": null
  },
  "oracle_source": "node-20.11.0",
  "tags": ["core", "path", "extname"]
}
