{
  "id": "fixture:path:join:basic-segments",
  "api_family": "path",
  "api_name": "join",
  "band": "core",
  "description": "Join multiple path segments",
  "input": {
    "args": ["foo", "bar", "baz"]
  },
  "expected_output": {
    "return_value": "foo/bar/baz",
    "error": null,
    "side_effects": null
  },
  "oracle_source": "node-20.11.0",
  "tags": ["core", "path", "join", "basic"]
}
